{"schemaVersion":"1.0.0","kind":"checkpoint","identity":"sha256:2164e4d4d219517d4e20a54633542d30e1f97f156708f22b70fde0d0ef4c9e1e","runId":"run-3","sequence":1,"workflowState":"EXECUTING","headCommit":"43113d9000000000000000000000000000000000","treeId":"2222222222222222222222222222222222222222","nextAction":"Run tests","gateReceiptIds":[],"createdAt":"2026-10-07T05:14:00Z"}
